{
  "version": "1.0",
  "run_id": "20260507T142300Z-005daed8",
  "created_at": "2026-05-07T14:23:00Z",
  "shotkit_version": "3.0.0",
  "operator": null,
  "project": {
    "title": "WhyStrohm. How The System Actually Works",
    "duration_s": 60,
    "aspect": "9:16",
    "framework": "founder-explainer"
  },
  "inputs": {
    "shots_ref": "shots.json",
    "shots_sha256": "3bde513a791d00ffe5c607d5e61c4d66e78d81515011d510de2b94e02a3e3dfb",
    "text_overlays_ref": "text-overlays.json",
    "text_overlays_sha256": "c319a0352bf8913d20083fe612cfb2adcd1502c5835a6985f86c971154a2c4ec",
    "brand_lock_ref": "brand-lock.snapshot.md",
    "brand_lock_sha256": "11e3525c5dcdd646f16503acbcb7015e8f4a77b8d80ea64ba8bbacadb69178c3",
    "brand_lock_source": "brand-packs/whystrohm.md",
    "brand_lock_configured": true
  },
  "rounds": []
}
