{
  "version": "1.0",
  "run_id": "20260507T142300Z-4b8f5796",
  "created_at": "2026-05-07T14:23:00Z",
  "shotkit_version": "3.0.0",
  "operator": null,
  "project": {
    "title": "WhyStrohm. The Content Infrastructure Pitch",
    "duration_s": 30,
    "aspect": "9:16",
    "framework": "pain-reframe-promise"
  },
  "inputs": {
    "shots_ref": "shots.json",
    "shots_sha256": "0f7e75a9aabd0aa9131bb6faad38c34aec86b852d16c7e92798a76e2d394f753",
    "text_overlays_ref": "text-overlays.json",
    "text_overlays_sha256": "ec1802afd4f5db12884745c23bb0d2e55d3d45f010eb59835b56d08214db4716",
    "brand_lock_ref": "brand-lock.snapshot.md",
    "brand_lock_sha256": "11e3525c5dcdd646f16503acbcb7015e8f4a77b8d80ea64ba8bbacadb69178c3",
    "brand_lock_source": "brand-packs/whystrohm.md",
    "brand_lock_configured": true
  },
  "rounds": []
}
